[
  {
    "requirement_id": "HA-P0-000",
    "source_document": "2026-07-11-claude-code-2.1.207-oracle-lab-hardening-amendments.md",
    "source_section": "Adversarial Validation WP0. Baseline and Contract Discovery plus Design Phase 0: Restore Trustworthy Baselines",
    "precedence": "hardening_amendments",
    "priority": "P0",
    "depends_on": [],
    "acceptance_gate": "phase_0_entry_baseline",
    "implementation_status": "locally_verified",
    "owner": "release-engineering",
    "repository": "cc-gateway",
    "implementation_files": ["tools/oracle-lab/freeze-baseline.ts"],
    "test_files": ["tests/oracle-lab-baseline-freeze.test.ts"],
    "verification_command": "npm exec tsx tests/oracle-lab-baseline-freeze.test.ts",
    "evidence_artifact": "docs/superpowers/evidence/phase-0/phase-0-entry-baseline.receipt.json",
    "last_verified_commit": "ab1b48fdd731b5f82cc4735de54416fbb858e6d6",
    "last_verified_at": "2026-07-11T11:37:16-07:00",
    "expiry": null,
    "known_gaps": [],
    "canary_evidence_ids": [], "production_gate_ids": [], "rollback_evidence_ids": [], "deployed_artifacts": [], "contradiction_ids": []
  },
  {
    "requirement_id": "HA-P0-001",
    "source_document": "2026-07-11-claude-code-2.1.207-oracle-lab-hardening-amendments.md",
    "source_section": "3.1 Requirement Status Registry",
    "precedence": "hardening_amendments",
    "priority": "P0",
    "depends_on": ["HA-P0-000"],
    "acceptance_gate": "phase_0_traceability",
    "implementation_status": "design_only",
    "owner": "cc-gateway-oracle-owner",
    "repository": "cc-gateway",
    "implementation_files": ["tools/oracle-lab/validate-requirements.ts", "docs/superpowers/schemas/oracle-lab-requirement.schema.json"],
    "test_files": ["tests/oracle-lab-traceability.test.ts"],
    "verification_command": "npm exec tsx tests/oracle-lab-traceability.test.ts",
    "evidence_artifact": "phase-0/traceability.json",
    "last_verified_commit": null, "last_verified_at": null, "expiry": null,
    "known_gaps": ["task commit is not yet bound by the Phase 0 exit receipt"],
    "canary_evidence_ids": [], "production_gate_ids": [], "rollback_evidence_ids": [], "deployed_artifacts": [], "contradiction_ids": []
  },
  {
    "requirement_id": "HA-P0-002",
    "source_document": "2026-07-11-claude-code-2.1.207-oracle-lab-hardening-amendments.md",
    "source_section": "3. Normative Status and Traceability",
    "precedence": "hardening_amendments",
    "priority": "P0",
    "depends_on": ["HA-P0-001"],
    "acceptance_gate": "phase_0_document_authority",
    "implementation_status": "design_only",
    "owner": "cc-gateway-oracle-owner",
    "repository": "cc-gateway",
    "implementation_files": ["docs/superpowers/specs/2026-07-11-claude-code-2.1.207-oracle-lab-design.md", "docs/superpowers/specs/2026-07-11-claude-code-2.1.207-adversarial-validation-v2.md", "docs/superpowers/specs/2026-07-11-claude-code-2.1.207-oracle-lab-hardening-amendments.md"],
    "test_files": ["tests/oracle-lab-traceability.test.ts"],
    "verification_command": "npm exec tsx tests/oracle-lab-traceability.test.ts",
    "evidence_artifact": "phase-0/traceability.json",
    "last_verified_commit": null, "last_verified_at": null, "expiry": null,
    "known_gaps": ["task commit is not yet bound by the Phase 0 exit receipt"],
    "canary_evidence_ids": [], "production_gate_ids": [], "rollback_evidence_ids": [], "deployed_artifacts": [], "contradiction_ids": []
  },
  {
    "requirement_id": "HA-P0-003",
    "source_document": "2026-07-11-claude-code-2.1.207-oracle-lab-hardening-amendments.md",
    "source_section": "3.3 Claim Matrix",
    "precedence": "hardening_amendments", "priority": "P0", "depends_on": ["HA-P0-001", "HA-P0-002"],
    "acceptance_gate": "phase_0_claim_matrix", "implementation_status": "design_only",
    "owner": "cc-gateway-oracle-owner", "repository": "cc-gateway", "implementation_files": [], "test_files": [],
    "verification_command": "npm exec tsx tests/oracle-lab-claim-matrix.test.ts", "evidence_artifact": "phase-0/claim-matrix.json",
    "last_verified_commit": null, "last_verified_at": null, "expiry": null, "known_gaps": ["claim matrix is scheduled for Task 2"],
    "canary_evidence_ids": [], "production_gate_ids": [], "rollback_evidence_ids": [], "deployed_artifacts": [], "contradiction_ids": []
  },
  {
    "requirement_id": "HA-P0-004",
    "source_document": "2026-07-11-claude-code-2.1.207-oracle-lab-hardening-amendments.md",
    "source_section": "3.2 Baseline Freeze Record",
    "precedence": "hardening_amendments", "priority": "P0", "depends_on": ["HA-P0-000"],
    "acceptance_gate": "phase_0_entry_baseline", "implementation_status": "locally_verified",
    "owner": "cc-gateway-oracle-owner", "repository": "cc-gateway", "implementation_files": ["tools/oracle-lab/freeze-baseline.ts"], "test_files": ["tests/oracle-lab-baseline-freeze.test.ts"],
    "verification_command": "npm exec tsx tests/oracle-lab-baseline-freeze.test.ts", "evidence_artifact": "docs/superpowers/evidence/phase-0/phase-0-entry-baseline.receipt.json",
    "last_verified_commit": "ab1b48fdd731b5f82cc4735de54416fbb858e6d6", "last_verified_at": "2026-07-11T11:37:16-07:00", "expiry": null, "known_gaps": [],
    "canary_evidence_ids": [], "production_gate_ids": [], "rollback_evidence_ids": [], "deployed_artifacts": [], "contradiction_ids": []
  },
  {
    "requirement_id": "HA-P0-005",
    "source_document": "2026-07-11-claude-code-2.1.207-oracle-lab-hardening-amendments.md",
    "source_section": "4. Required Architecture Decision: Gateway Compromise Boundary",
    "precedence": "hardening_amendments", "priority": "P0", "depends_on": ["HA-P0-001", "HA-P0-003"],
    "acceptance_gate": "phase_0_gateway_boundary_adr", "implementation_status": "failing_test_added",
    "owner": "cc-gateway-oracle-owner and release-approver", "repository": "cc-gateway", "implementation_files": ["docs/superpowers/adr/0001-gateway-compromise-boundary.md", "src/config.ts", "config.sub2api.formal-pool.example.yaml", "docs/formal-pool-sub2api-safety.md"], "test_files": ["tests/config.test.ts", "tests/formal-pool-safety-doc.test.ts"],
    "verification_command": "npm exec tsx tests/config.test.ts && npm exec tsx tests/formal-pool-safety-doc.test.ts", "evidence_artifact": "phase-0/gateway-compromise-boundary.json",
    "last_verified_commit": null, "last_verified_at": null, "expiry": null, "known_gaps": ["protected_gateway production and real-canary authority remain disabled pending mandatory Phase 4 policy broker verification", "task commit is not yet bound by the Phase 0 exit receipt"],
    "canary_evidence_ids": [], "production_gate_ids": [], "rollback_evidence_ids": [], "deployed_artifacts": [], "contradiction_ids": []
  },
  {
    "requirement_id": "HA-P0-006",
    "source_document": "2026-07-11-claude-code-2.1.207-oracle-lab-design.md",
    "source_section": "Design 9. Shared Contract Discovery plus Adversarial Validation WP0. Baseline and Contract Discovery",
    "precedence": "hardening_amendments", "priority": "P0", "depends_on": ["HA-P0-000", "HA-P0-004"],
    "acceptance_gate": "phase_0_shared_contract_discovery", "implementation_status": "design_only",
    "owner": "cc-gateway-oracle-owner", "repository": "cc-gateway", "implementation_files": [], "test_files": [],
    "verification_command": "npm exec tsx tests/formal-pool-contract-fixture.test.ts", "evidence_artifact": "phase-0/shared-contract-discovery.json",
    "last_verified_commit": null, "last_verified_at": null, "expiry": null, "known_gaps": ["contract discovery repair is scheduled for Task 5"],
    "canary_evidence_ids": [], "production_gate_ids": [], "rollback_evidence_ids": [], "deployed_artifacts": [], "contradiction_ids": []
  },
  {
    "requirement_id": "HA-P0-007",
    "source_document": "2026-07-11-claude-code-2.1.207-oracle-lab-hardening-amendments.md",
    "source_section": "16. Required Deliverables (H0 traceability/context/command harness)",
    "precedence": "hardening_amendments", "priority": "P0", "depends_on": ["HA-P0-001", "HA-P0-003", "HA-P0-004", "HA-P0-006"],
    "acceptance_gate": "phase_0_h0_harness", "implementation_status": "design_only",
    "owner": "cc-gateway-oracle-owner", "repository": "cc-gateway", "implementation_files": [], "test_files": [],
    "verification_command": "npm exec tsx tests/oracle-lab-h0-harness.test.ts", "evidence_artifact": "phase-0/h0-handoff.json",
    "last_verified_commit": null, "last_verified_at": null, "expiry": null, "known_gaps": ["H0 harness is scheduled for Task 8"],
    "canary_evidence_ids": [], "production_gate_ids": [], "rollback_evidence_ids": [], "deployed_artifacts": [], "contradiction_ids": []
  },
  {
    "requirement_id": "HA-P0-008",
    "source_document": "2026-07-11-claude-code-2.1.207-oracle-lab-hardening-amendments.md",
    "source_section": "18. Acceptance Criteria for This Amendment plus Design Validation Gates",
    "precedence": "hardening_amendments", "priority": "P0", "depends_on": ["HA-P0-001", "HA-P0-003", "HA-P0-004", "HA-P0-005", "HA-P0-006", "HA-P0-007", "HA-P0-009", "AV-B1-001", "AV-B2-001", "AV-B3-001", "AV-B4-001", "AV-B5-001", "AV-B6-001"],
    "acceptance_gate": "phase_0_exit", "implementation_status": "design_only",
    "owner": "cc-gateway-oracle-owner and security-reviewer", "repository": "cc-gateway", "implementation_files": [], "test_files": [],
    "verification_command": "npm exec tsx tests/oracle-lab-phase-0-exit.test.ts", "evidence_artifact": "phase-0/exit-report.json",
    "last_verified_commit": null, "last_verified_at": null, "expiry": null, "known_gaps": ["all Phase 0 exit dependencies remain mandatory"],
    "canary_evidence_ids": [], "production_gate_ids": [], "rollback_evidence_ids": [], "deployed_artifacts": [], "contradiction_ids": []
  },
  {
    "requirement_id": "HA-P0-009",
    "source_document": "2026-07-11-claude-code-2.1.207-oracle-lab-hardening-amendments.md",